{
 "schema": 1,
 "family": "bounds/output-capacity-lockstep",
 "tags": [
  "bounds",
  "proof-2",
  "output-capacity-lockstep"
 ],
 "hypothesis": "A checked N <= 3*floor(C/4) signature fact proves only exact base64-shaped i=3k/o=4k output groups; every changed dependency, stride, target, offset, mutation, call, or tail premise fails closed.",
 "measurement": {
  "function": "probe",
  "metric": "proof.sites",
  "opt": "O2",
  "facts_on": "compile_program(source, alias=true, proof_report=report)",
  "facts_off": "compile_program(source, alias=false, proof_report=report)",
  "note": "Structured per-site accounting is the oracle; retained boundary checks remain visible independently of backend optimization."
 },
 "cases": [
  {
   "id": "p01-full-loop-o",
   "source": "p01-full-loop-o.xl",
   "hypothesis": "The checked 3:4 capacity relation plus exact i/o lockstep proves the full-loop out[o] store.",
   "tags": [
    "positive",
    "full-loop",
    "offset-0"
   ],
   "maturity": "gate",
   "expected": {
    "proof_classification": "elided",
    "bounds_sites": 1,
    "obligation_status": "derived",
    "obligation_exactness": "sufficient",
    "requirement_relation": "equivalent",
    "first_failed_premise": null,
    "first_missing_fact": null
   }
  },
  {
   "id": "p02-full-loop-o3",
   "source": "p02-full-loop-o3.xl",
   "hypothesis": "The same induction proves the boundary full-loop out[o+3] store.",
   "tags": [
    "positive",
    "full-loop",
    "offset-3",
    "boundary"
   ],
   "maturity": "gate",
   "expected": {
    "proof_classification": "elided",
    "bounds_sites": 1,
    "obligation_status": "derived",
    "obligation_exactness": "sufficient",
    "requirement_relation": "equivalent",
    "first_failed_premise": null,
    "first_missing_fact": null
   }
  },
  {
   "id": "p03-tail-one",
   "source": "p03-tail-one.xl",
   "hypothesis": "The exact tail==1 arm inherits one final output group from the checked capacity relation.",
   "tags": [
    "positive",
    "tail-1",
    "offset-0"
   ],
   "maturity": "gate",
   "expected": {
    "proof_classification": "elided",
    "bounds_sites": 1,
    "obligation_status": "derived",
    "obligation_exactness": "sufficient",
    "requirement_relation": "equivalent",
    "first_failed_premise": null,
    "first_missing_fact": null
   }
  },
  {
   "id": "p04-tail-two",
   "source": "p04-tail-two.xl",
   "hypothesis": "The exact tail==2 arm proves its boundary out[o+3] store.",
   "tags": [
    "positive",
    "tail-2",
    "offset-3",
    "boundary"
   ],
   "maturity": "gate",
   "expected": {
    "proof_classification": "elided",
    "bounds_sites": 1,
    "obligation_status": "derived",
    "obligation_exactness": "sufficient",
    "requirement_relation": "equivalent",
    "first_failed_premise": null,
    "first_missing_fact": null
   }
  },
  {
   "id": "p05-complete-groups",
   "source": "p05-complete-groups.xl",
   "hypothesis": "The base64-shaped four full-loop, four tail-1, and four tail-2 stores are all proved.",
   "tags": [
    "positive",
    "base64-shape",
    "full-loop",
    "tails"
   ],
   "maturity": "gate",
   "expected": {
    "proof_classification": "elided",
    "bounds_sites": 12,
    "checked_automation_ready": true,
    "checked_automation_disposition_counts": {
     "automatically-accounted": 12,
     "intrinsic-dynamic": 0,
     "hard-finding": 0,
     "unaccounted": 0
    },
    "obligation_status": "derived",
    "obligation_exactness": "exact",
    "requirement_relation": "equivalent",
    "first_failed_premise": null,
    "first_missing_fact": null
   }
  },
  {
   "id": "m01-o3-o4",
   "source": "m01-o3-o4.xl",
   "hypothesis": "Per-site accounting proves o+3 and retains the off-by-one o+4 store in one canonical loop.",
   "tags": [
    "mixed",
    "offset-3",
    "offset-4",
    "off-by-one"
   ],
   "maturity": "gate",
   "expected": {
    "proof_classification": "mixed",
    "bounds_sites": 2,
    "proved_sites": 1,
    "retained_sites": 1,
    "checked_automation_ready": false,
    "checked_automation_disposition_counts": {
     "automatically-accounted": 1,
     "intrinsic-dynamic": 0,
     "hard-finding": 0,
     "unaccounted": 1
    },
    "obligation_status_counts": {
     "derived": 1,
     "failed-premise": 1
    },
    "obligation_exactness_counts": {
     "sufficient": 1,
     "unknown": 1
    },
    "requirement_relation_counts": {
     "equivalent": 1,
     "unknown": 1
    },
    "first_failed_premise_reason_counts": {
     "<null>": 1,
     "body.output-offset-funded": 1
    },
    "first_missing_fact": null
   }
  },
  {
   "id": "m02-sibling-offset-mutation",
   "source": "m02-sibling-offset-mutation.xl",
   "hypothesis": "Sibling tail arms have lexical offset facts: the stable slot is proved and the same-spelled mutated sibling is retained.",
   "tags": [
    "mixed",
    "sibling-scope",
    "name-reuse",
    "mutation"
   ],
   "maturity": "gate",
   "expected": {
    "proof_classification": "mixed",
    "bounds_sites": 2,
    "proved_sites": 1,
    "retained_sites": 1,
    "obligation_status_counts": {
     "derived": 1,
     "failed-premise": 1
    },
    "obligation_exactness_counts": {
     "sufficient": 1,
     "unknown": 1
    },
    "requirement_relation_counts": {
     "equivalent": 1,
     "unknown": 1
    },
    "first_failed_premise_reason_counts": {
     "<null>": 1,
     "body.output-offset-stability": 1
    },
    "first_missing_fact": null
   }
  },
  {
   "id": "n01-missing-relation",
   "source": "n01-missing-relation.xl",
   "hypothesis": "No checked signature relation means the output store remains checked despite exact lockstep.",
   "tags": [
    "negative",
    "missing-relation",
    "soundness"
   ],
   "maturity": "gate",
   "expected": {
    "proof_classification": "checked",
    "bounds_sites": 1,
    "checked_automation_ready": false,
    "checked_automation_disposition_counts": {
     "automatically-accounted": 0,
     "intrinsic-dynamic": 0,
     "hard-finding": 1,
     "unaccounted": 0
    },
    "obligation_status": "derived",
    "obligation_exactness": "sufficient",
    "requirement_relation": "missing",
    "first_failed_premise": null,
    "first_missing_fact": {
     "family": "output-capacity-lockstep",
     "source": "src",
     "output": "out",
     "input_stride": 3,
     "output_stride": 4,
     "condition": "len(source) <= 3 * floor(len(output) / 4)"
    }
   }
  },
  {
   "id": "n02-wrong-relation-comparator",
   "source": "n02-wrong-relation-comparator.xl",
   "hypothesis": "A strict comparison is outside the one normalized capacity predicate and is retained conservatively.",
   "tags": [
    "negative",
    "wrong-relation",
    "comparator",
    "conservative"
   ],
   "maturity": "gate",
   "expected": {
    "proof_classification": "checked",
    "bounds_sites": 1,
    "checked_automation_ready": false,
    "checked_automation_disposition_counts": {
     "automatically-accounted": 0,
     "intrinsic-dynamic": 0,
     "hard-finding": 1,
     "unaccounted": 0
    },
    "obligation_status": "derived",
    "obligation_exactness": "sufficient",
    "requirement_relation": "mismatch",
    "first_failed_premise": {
     "reason": "requirement.comparator-ile",
     "path": "requires[4].condition",
     "expected": "ile<u64>",
     "observed": "ilt"
    },
    "first_missing_fact": {
     "family": "output-capacity-lockstep",
     "source": "src",
     "output": "out",
     "input_stride": 3,
     "output_stride": 4,
     "condition": "len(source) <= 3 * floor(len(output) / 4)"
    }
   }
  },
  {
   "id": "n03-wrong-output-buffer",
   "source": "n03-wrong-output-buffer.xl",
   "hypothesis": "Capacity checked for a distinct buffer cannot prove a store through out.",
   "tags": [
    "negative",
    "wrong-buffer",
    "soundness"
   ],
   "maturity": "gate",
   "expected": {
    "proof_classification": "checked",
    "bounds_sites": 1,
    "obligation_status": "derived",
    "obligation_exactness": "sufficient",
    "requirement_relation": "mismatch",
    "first_failed_premise": "requirement.matches-body-output",
    "first_missing_fact": {
     "family": "output-capacity-lockstep",
     "source": "src",
     "output": "out",
     "input_stride": 3,
     "output_stride": 4,
     "condition": "len(source) <= 3 * floor(len(output) / 4)"
    }
   }
  },
  {
   "id": "n04-wrong-source-buffer",
   "source": "n04-wrong-source-buffer.xl",
   "hypothesis": "A relation using another source length cannot bound the loop driven by src.",
   "tags": [
    "negative",
    "wrong-source",
    "wrong-bound",
    "soundness"
   ],
   "maturity": "gate",
   "expected": {
    "proof_classification": "checked",
    "bounds_sites": 1,
    "obligation_status": "derived",
    "obligation_exactness": "sufficient",
    "requirement_relation": "mismatch",
    "first_failed_premise": "requirement.matches-body-source",
    "first_missing_fact": {
     "family": "output-capacity-lockstep",
     "source": "src",
     "output": "out",
     "input_stride": 3,
     "output_stride": 4,
     "condition": "len(source) <= 3 * floor(len(output) / 4)"
    }
   }
  },
  {
   "id": "n05-nonzero-output-init",
   "source": "n05-nonzero-output-init.xl",
   "hypothesis": "The o=4k induction requires literal zero initialization.",
   "tags": [
    "negative",
    "wrong-init",
    "output-index",
    "soundness"
   ],
   "maturity": "gate",
   "expected": {
    "proof_classification": "checked",
    "bounds_sites": 1,
    "obligation_status": "failed-premise",
    "obligation_exactness": "unknown",
    "requirement_relation": "unknown",
    "first_failed_premise": "body.output-base",
    "first_missing_fact": null
   }
  },
  {
   "id": "n06-wrong-input-stride",
   "source": "n06-wrong-input-stride.xl",
   "hypothesis": "i+=2 can execute more output groups than the 3:4 relation funds.",
   "tags": [
    "negative",
    "wrong-stride",
    "input",
    "soundness"
   ],
   "maturity": "gate",